{
  "id": "bountyhub-002",
  "title": "Validate idempotent retry in the billing webhook handler",
  "source": "bountyhub",
  "url": "https://bountyhub.dev/b/bountyhub-002",
  "repo": "ledger/payments-api",
  "task_type": "validate",
  "reward_usd": 160,
  "posted_at": "2026-10-04T12:00:00Z",
  "updated_at": "2026-10-06T03:00:00Z",
  "competition_count": 2,
  "agent_solvable": 0.80,
  "difficulty": "medium",
  "language": "Python",
  "tags": ["validate", "idempotency", "webhook", "billing"],
  "description": "Prove that a redelivered billing webhook does not create a duplicate charge. Write a deterministic replay test against the handler."
}
